{
  "actor": {
    "id": "ayran.fixture",
    "kind": "service",
    "version": "1.0.0"
  },
  "aggregate_id": "nod_01J00000000000000000000001",
  "aggregate_version": 2,
  "batch_id": "bat_01J00000000000000000000001",
  "body": {
    "content_hash": "sha256:e739866de8d84425cc8d9c20198d7c98808bdc4c7c09e3783b5da06169d86b32",
    "contract_id": "graph-node@1.0.0",
    "object_id": "nod_01J00000000000000000000001",
    "transition": {
      "kind": "snapshot",
      "reason": "Fixture revision",
      "supersedes": [
        "evt_01J00000000000000000000020"
      ]
    },
    "value": {
      "confidence": 1.0,
      "created_at": "2026-08-12T12:00:00Z",
      "evidence_grade": "lead",
      "evidence_refs": [],
      "integrity": {
        "algorithm": "sha256",
        "canonicalization": "rfc8785",
        "content_hash": "sha256:e739866de8d84425cc8d9c20198d7c98808bdc4c7c09e3783b5da06169d86b32",
        "excluded_fields": [
          "integrity.content_hash"
        ]
      },
      "namespace": "target",
      "node_id": "nod_01J00000000000000000000001",
      "node_type": "Contract",
      "properties": [],
      "provenance": [
        {
          "license_or_terms": "private-test-fixture",
          "provenance_id": "prv_01J00000000000000000000001",
          "raw_hash": "sha256:bbbbbbbbbbbbbbbbbbbbbbbbbbbbbbbbbbbbbbbbbbbbbbbbbbbbbbbbbbbbbbbb",
          "retrieved_at": "2026-08-12T12:00:00Z",
          "source_uri": "https://fixtures.ayran.dev/m0",
          "source_version": "fixture-v1",
          "transformation_lineage": []
        }
      ],
      "revision": 2,
      "run_id": "run_01J00000000000000000000001",
      "schema_version": "1.0.0",
      "source_locator": "target/src/Vault.sol:1",
      "status": "active",
      "trust_class": "deterministic_tool",
      "valid_from_event": "evt_01J00000000000000000000021"
    }
  },
  "causation_id": "op_01J00000000000000000000019",
  "config_hash": "sha256:eeeeeeeeeeeeeeeeeeeeeeeeeeeeeeeeeeeeeeeeeeeeeeeeeeeeeeeeeeeeeeee",
  "created_at": "2026-08-12T12:00:00Z",
  "event_hash": "sha256:fe68d742ff2f79c86f6095707cc2c6f718ebb8997a560f627925fde1bd036e45",
  "event_id": "evt_01J00000000000000000000021",
  "event_type": "node.revised",
  "idempotency_key": "fixture:journal:1",
  "integrity": {
    "algorithm": "sha256",
    "canonicalization": "rfc8785",
    "content_hash": "sha256:fe68d742ff2f79c86f6095707cc2c6f718ebb8997a560f627925fde1bd036e45",
    "excluded_fields": [
      "integrity.content_hash",
      "event_hash"
    ]
  },
  "journal_format_version": 1,
  "operation_id": "op_01J00000000000000000000020",
  "ordinal": 2,
  "previous_event_hash": "sha256:a3aa3d716159905e183ff846c2bcbccb4a48a71a49bbfd772cc65d49f8b0bc94",
  "provenance": [
    {
      "license_or_terms": "private-test-fixture",
      "provenance_id": "prv_01J00000000000000000000001",
      "raw_hash": "sha256:bbbbbbbbbbbbbbbbbbbbbbbbbbbbbbbbbbbbbbbbbbbbbbbbbbbbbbbbbbbbbbbb",
      "retrieved_at": "2026-08-12T12:00:00Z",
      "source_uri": "https://fixtures.ayran.dev/m0",
      "source_version": "fixture-v1",
      "transformation_lineage": []
    }
  ],
  "schema_version": "1.0.0",
  "seq": 2,
  "source_version": "target@fixture-v1",
  "stream": {
    "namespace": "target",
    "run_id": "run_01J00000000000000000000001",
    "stream_id": "str_01J00000000000000000000001",
    "target_identity": {
      "commit": "1111111111111111111111111111111111111111",
      "scope_id": "scp_01J00000000000000000000001",
      "source_tree_hash": "sha256:dddddddddddddddddddddddddddddddddddddddddddddddddddddddddddddddd",
      "target_id": "tgt_01J00000000000000000000001"
    },
    "target_key": "sha256:dddddddddddddddddddddddddddddddddddddddddddddddddddddddddddddddd"
  }
}
